{
  "name": "TimelineFeed",
  "level": "blueprint",
  "category": "activity",
  "description": "An activity timeline showing chronological events with icons, timestamps, and details. Ideal for event logs, audit trails, and activity feeds.",
  "visual": {
    "description": "Vertical timeline with a connecting line. Each event has a colored dot, timestamp, title, description, and optional actor avatar. Events grouped by date.",
    "layout": "date headers + vertical timeline with event cards",
    "tokens": [
      "color.primary.600",
      "color.primary.50",
      "color.neutral.200",
      "color.neutral.500",
      "spacing.3",
      "spacing.4",
      "borderRadius.md",
      "shadow.sm"
    ]
  },
  "interface": {
    "props": [
      {
        "name": "events",
        "type": "array",
        "required": false,
        "description": "Array of event objects with id, title, description, timestamp, type, actor"
      },
      {
        "name": "title",
        "type": "string",
        "required": false,
        "description": "Feed title",
        "defaultValue": "Activity"
      }
    ],
    "callbacks": ["onEventClick", "onLoadMore"],
    "slots": []
  },
  "examples": [
    { "prompt": "activity timeline", "match": 0.95 },
    { "prompt": "event log", "match": 0.9 },
    { "prompt": "activity feed", "match": 0.95 },
    { "prompt": "audit trail", "match": 0.9 },
    { "prompt": "changelog", "match": 0.85 },
    { "prompt": "event history", "match": 0.9 },
    { "prompt": "recent activity", "match": 0.85 },
    { "prompt": "timeline of events", "match": 0.9 }
  ],
  "tags": ["timeline", "activity", "events", "feed", "log", "audit", "history", "blueprint"]
}
