{
  "name": "DashboardBlueprint",
  "level": "blueprint",
  "category": "layout",
  "description": "A 3-column responsive dashboard layout with header, sidebar, main content area, and optional footer. Ideal for admin panels, analytics views, and data-heavy applications.",
  "visual": {
    "description": "Full-screen layout with a fixed header at top, collapsible sidebar on the left, scrollable main content area, and optional footer. On mobile, the sidebar becomes a drawer that slides in from the left. Uses subtle borders and shadows to separate regions.",
    "layout": "responsive grid with header + sidebar + main + footer regions",
    "tokens": [
      "color.neutral.50",
      "color.neutral.100",
      "color.neutral.200",
      "color.neutral.800",
      "color.primary.600",
      "spacing.4",
      "spacing.6",
      "spacing.8",
      "borderRadius.lg",
      "shadow.sm"
    ]
  },
  "interface": {
    "props": [
      {
        "name": "title",
        "type": "string",
        "required": false,
        "description": "Dashboard title shown in the header",
        "defaultValue": "Dashboard"
      },
      {
        "name": "user",
        "type": "object",
        "required": false,
        "description": "Current user data (name, avatar, role) for header display"
      },
      {
        "name": "sidebarItems",
        "type": "array",
        "required": false,
        "description": "Navigation items for the sidebar (label, icon, href, active)"
      },
      {
        "name": "sidebarCollapsed",
        "type": "boolean",
        "required": false,
        "description": "Whether the sidebar starts collapsed",
        "defaultValue": false
      },
      {
        "name": "showFooter",
        "type": "boolean",
        "required": false,
        "description": "Whether to show the footer region",
        "defaultValue": false
      }
    ],
    "callbacks": ["onNavigate", "onSidebarToggle", "onUserMenuClick"],
    "slots": ["header", "sidebar", "main", "footer"]
  },
  "examples": [
    { "prompt": "dashboard", "match": 0.95 },
    { "prompt": "admin dashboard", "match": 0.95 },
    { "prompt": "dashboard layout", "match": 0.9 },
    { "prompt": "analytics dashboard", "match": 0.9 },
    { "prompt": "admin panel", "match": 0.85 },
    { "prompt": "dashboard with sidebar", "match": 0.9 },
    { "prompt": "three column layout with header", "match": 0.8 },
    { "prompt": "data dashboard view", "match": 0.85 }
  ],
  "tags": ["dashboard", "admin", "layout", "sidebar", "header", "analytics", "panel", "blueprint"]
}
