{
  "name": "OAuthConsentScreen",
  "level": "composite",
  "category": "system",
  "description": "OAuth consent screen for credential authorization. Service icon, permission scopes, Allow Once/Always Allow/Deny buttons. Used by ggui_request_credential tool when agent needs OAuth access.",
  "visual": {
    "description": "Centered card on semi-transparent overlay. Service icon with colored ring, permission list with shield icons, three action buttons (primary coral, secondary outline, muted deny link).",
    "layout": "centered modal card (max-width 400px)",
    "tokens": [
      "color.neutral.50",
      "color.neutral.100",
      "color.neutral.800",
      "spacing.4",
      "spacing.6",
      "borderRadius.xl",
      "shadow.lg"
    ]
  },
  "interface": {
    "props": [
      {
        "name": "serviceId",
        "type": "string",
        "required": true,
        "description": "OAuth service identifier"
      },
      {
        "name": "serviceName",
        "type": "string",
        "required": true,
        "description": "Human-readable service name"
      },
      {
        "name": "serviceIcon",
        "type": "string",
        "required": true,
        "description": "Service icon URL (CloudFront)"
      },
      {
        "name": "scopes",
        "type": "array",
        "required": true,
        "description": "OAuth scopes being requested (array of scope ID strings, e.g. ['contacts.read', 'calendar.write'])"
      },
      {
        "name": "scopeLabels",
        "type": "object",
        "required": false,
        "description": "Scope ID → human-readable label mapping (Record<string, string>)"
      },
      {
        "name": "reason",
        "type": "string",
        "required": false,
        "description": "Why the agent needs this credential"
      },
      {
        "name": "appName",
        "type": "string",
        "required": false,
        "description": "The ggui app requesting access"
      },
      {
        "name": "brandColor",
        "type": "string",
        "required": false,
        "description": "Service brand color for button theming"
      }
    ],
    "callbacks": ["onGrant", "onDeny"],
    "slots": []
  },
  "examples": [
    { "prompt": "oauth consent", "match": 0.95 },
    { "prompt": "credential authorization", "match": 0.9 },
    { "prompt": "connect service permission", "match": 0.85 }
  ],
  "tags": ["system", "oauth", "consent", "credential", "authorization", "permission"]
}
