{
  "name": "ComparisonTable",
  "level": "blueprint",
  "category": "data",
  "description": "A side-by-side comparison table for products, plans, or options. Features include highlighted recommended option, feature checkmarks, and category grouping.",
  "visual": {
    "description": "Horizontal table with sticky first column for feature names. Each column represents an option with header, price, and feature rows with check/cross indicators. Recommended column has a highlight border.",
    "layout": "horizontal comparison columns with feature rows",
    "tokens": [
      "color.primary.600",
      "color.primary.50",
      "color.success.500",
      "color.neutral.200",
      "color.neutral.500",
      "spacing.3",
      "spacing.4",
      "borderRadius.md",
      "shadow.sm"
    ]
  },
  "interface": {
    "props": [
      {
        "name": "options",
        "type": "array",
        "required": true,
        "description": "Array of option objects with name, price, description, recommended flag, features record"
      },
      {
        "name": "features",
        "type": "array",
        "required": true,
        "description": "Array of feature objects with key, label, category"
      },
      {
        "name": "title",
        "type": "string",
        "required": false,
        "description": "Table title",
        "defaultValue": "Compare Options"
      }
    ],
    "callbacks": ["onSelect"],
    "slots": []
  },
  "examples": [
    { "prompt": "comparison table", "match": 0.95 },
    { "prompt": "pricing comparison", "match": 0.9 },
    { "prompt": "feature comparison", "match": 0.95 },
    { "prompt": "plan comparison", "match": 0.9 },
    { "prompt": "side by side comparison", "match": 0.9 },
    { "prompt": "compare products", "match": 0.85 },
    { "prompt": "which plan should I choose", "match": 0.8 },
    { "prompt": "compare options", "match": 0.9 }
  ],
  "tags": ["comparison", "table", "pricing", "features", "plans", "products", "blueprint"]
}
