{
  "name": "MetricCards",
  "level": "blueprint",
  "category": "analytics",
  "description": "A grid of metric cards showing KPIs with values, trends, and sparkline charts. Ideal for analytics dashboards, monitoring agents, and business intelligence views.",
  "visual": {
    "description": "Responsive grid of metric cards. Each card shows a label, large value, trend indicator (up/down arrow with percentage), and a small sparkline chart. Cards have subtle shadows and rounded corners.",
    "layout": "responsive grid of metric cards",
    "tokens": [
      "color.primary.600",
      "color.success.500",
      "color.error.500",
      "color.neutral.200",
      "color.neutral.500",
      "spacing.3",
      "spacing.4",
      "borderRadius.md",
      "shadow.sm"
    ]
  },
  "interface": {
    "props": [
      {
        "name": "metrics",
        "type": "array",
        "required": false,
        "description": "Array of metric objects with label, value, change (percentage), trend (up|down|flat), sparkline (number array)"
      },
      {
        "name": "columns",
        "type": "number",
        "required": false,
        "description": "Number of columns in the grid",
        "defaultValue": 4
      }
    ],
    "callbacks": ["onMetricClick"],
    "slots": []
  },
  "examples": [
    { "prompt": "metric cards", "match": 0.95 },
    { "prompt": "KPI dashboard", "match": 0.9 },
    { "prompt": "analytics cards", "match": 0.9 },
    { "prompt": "metrics overview", "match": 0.9 },
    { "prompt": "key metrics with trends", "match": 0.9 },
    { "prompt": "business metrics dashboard", "match": 0.85 },
    { "prompt": "show me the numbers", "match": 0.8 },
    { "prompt": "performance metrics", "match": 0.85 }
  ],
  "tags": ["metrics", "KPI", "analytics", "dashboard", "sparkline", "trends", "cards", "blueprint"]
}
