{
  "name": "SettingsPage",
  "level": "blueprint",
  "category": "settings",
  "description": "A full settings screen with sections for profile, notifications, and preferences",
  "visual": {
    "description": "Full-width page with navigation sidebar on larger screens. Main content area shows settings sections in cards. Each section has a header and grouped controls. Uses subtle dividers between sections.",
    "layout": "responsive sidebar + content area with stacked cards",
    "tokens": [
      "color.primary.600",
      "color.neutral.100",
      "color.neutral.200",
      "spacing.6",
      "spacing.8",
      "borderRadius.lg"
    ]
  },
  "interface": {
    "props": [
      {
        "name": "user",
        "type": "object",
        "required": false,
        "description": "Current user data (name, email, avatar)"
      },
      {
        "name": "settings",
        "type": "object",
        "required": false,
        "description": "Current settings values"
      },
      {
        "name": "sections",
        "type": "array",
        "required": false,
        "description": "Which sections to show (profile, notifications, preferences, security)"
      }
    ],
    "callbacks": ["onSave", "onChange"],
    "slots": ["header", "footer"]
  },
  "examples": [
    { "prompt": "settings page", "match": 0.95 },
    { "prompt": "user settings screen", "match": 0.9 },
    { "prompt": "preferences page", "match": 0.85 },
    { "prompt": "account settings", "match": 0.85 },
    { "prompt": "profile settings", "match": 0.8 }
  ],
  "tags": ["settings", "preferences", "profile", "account", "page", "configuration"]
}
